{
  "$schema": "http://json-schema.org/draft-07/schema#",
  "type": "object",
  "properties": {
    "schemaVersion": {
      "type": "string",
      "default": "1.0.0"
    },
    "id": {
      "type": "string",
      "format": "uuid"
    },
    "name": {
      "type": "string",
      "maxLength": 50
    },
    "description": {
      "type": "string",
      "maxLength": 200
    },
    "created_at": {
      "type": "string",
      "format": "date-time"
    },
    "updated_at": {
      "type": "string",
      "format": "date-time"
    },
    "gains": {
      "type": "object",
      "properties": {
        "speech": {
          "type": "number",
          "minimum": 0,
          "maximum": 1
        },
        "noise": {
          "type": "number",
          "minimum": 0,
          "maximum": 1
        },
        "events": {
          "type": "number",
          "minimum": 0,
          "maximum": 1
        }
      },
      "required": [
        "speech",
        "noise",
        "events"
      ]
    },
    "suppressions": {
      "type": "object",
      "additionalProperties": {
        "type": "boolean"
      }
    },
    "autoTriggers": {
      "type": "array",
      "items": {
        "type": "object",
        "properties": {
          "category": {
            "type": "string"
          },
          "threshold": {
            "type": "number",
            "minimum": 0,
            "maximum": 1
          }
        }
      }
    },
    "learnedPriority": {
      "type": "number",
      "description": "Auto-learned priority based on user selection frequency",
      "default": 0
    },
    "isDefault": {
      "type": "boolean"
    },
    "isSystemProfile": {
      "type": "boolean"
    }
  },
  "required": [
    "id",
    "name",
    "gains",
    "schemaVersion"
  ]
}
